{
  "schemaVersion": "v0",
  "provider": "network.provider",
  "providerVersion": "v0",
  "minFabricProtocol": 0,
  "maxFabricProtocol": 0,
  "capabilities": [
    "network.inspect",
    "network.manage"
  ],
  "actions": {
    "inspect": {
      "capability": "network.inspect",
      "mode": "read",
      "risk": "read-only",
      "effects": [],
      "arguments": {
        "id": "urn:omarchy:fabric:provider:network:inventory-arguments:v0",
        "version": "v0"
      },
      "result": {
        "id": "urn:omarchy:fabric:provider:network:inventory-result:v0",
        "version": "v0"
      },
      "preflight": null,
      "state": null,
      "supportsRollback": false,
      "supportsCancellation": false
    },
    "wifi.set-enabled": {
      "capability": "network.manage",
      "mode": "operation",
      "risk": "consequential",
      "effects": [
        "mutating",
        "network"
      ],
      "arguments": {
        "id": "urn:omarchy:fabric:provider:network:operation-arguments:v0",
        "version": "v0"
      },
      "result": {
        "id": "urn:omarchy:fabric:provider:network:operation-result:v0",
        "version": "v0"
      },
      "preflight": {
        "id": "urn:omarchy:fabric:provider:network:operation-preflight:v0",
        "version": "v0"
      },
      "state": {
        "id": "urn:omarchy:fabric:provider:network:operation-state:v0",
        "version": "v0"
      },
      "supportsRollback": true,
      "supportsCancellation": false
    }
  }
}
